{
  "id": "kashiwa-titan",
  "type": "work",
  "title": "TITAN: A Holographic Sound Forest of Mechanical Photosynthesis",
  "subtitle": "Kashiwa Daisuke × Yuki Murata × Ewan Qian",
  "years": "2025",
  "summary": "A live audiovisual collaboration developed through procedural generation, temporal structure, and spatial atmosphere.",
  "practiceLine": "live-collaboration",
  "coverImage": "works/kashiwa-titan/cover-01.jpg",
  "relatedNodes": [
    "bo-live-shenzhen"
  ],
  "relatedWritings": [],
  "relatedVenues": [],
  "tags": [
    "live",
    "audiovisual",
    "collaboration"
  ]
}
