{
  "id": "timer",
  "type": "work",
  "title": "TIMER 控时者",
  "subtitle": "时间结构与音画组织",
  "years": "2024–2025",
  "summary": "An audiovisual series centered on temporal structure, rhythm, frequency, and the internal organization of image and sound.",
  "practiceLine": "temporal-structure",
  "coverImage": "works/timer/cover-01.jpg",
  "relatedNodes": [],
  "relatedWritings": [],
  "relatedVenues": [],
  "tags": [
    "time",
    "rhythm",
    "audiovisual"
  ]
}
